{
  "schema_version": 2,
  "pack": "varda",
  "version": "0.1.4",
  "minecraft": "1.21.1",
  "neoforge": {
    "version": "21.1.228",
    "installer_url": "https://maven.neoforged.net/releases/net/neoforged/neoforge/21.1.228/neoforge-21.1.228-installer.jar",
    "sha1": "0123456789abcdef0123456789abcdef01234567"
  },
  "server_config": {
    "url": "https://example.invalid/server-config.zip",
    "sha1": "0123456789abcdef0123456789abcdef01234567"
  },
  "mods": [
    {
      "name": "Example Mod",
      "url": "https://example.invalid/example.jar",
      "website_url": "https://example.invalid",
      "sha1": "0123456789abcdef0123456789abcdef01234567",
      "size": 1234
    }
  ]
}
